{
  "$schema": "https://raw.githubusercontent.com/mfmayer/gosk/main/api/json-schema/skill-schema-v01.json",
  "name": "weather",
  "description": "A skill that allows to access weather information and provide current and forecast weather data.",
  "plannable": true,
  "generators": {
    "gpt-3.5-turbo": {
      "model": "gpt-3.5-turbo",
      "temperature": 0.7,
      "max_tokens": 64,
      "top_p": 1,
      "frequency_penalty": 0,
      "presence_penalty": 0
    }
  }
}